	title	description	salary	location	jobtype	duration	industry	education	career	ref_code
140	Data Engineer X 2 - Manchester. - Adria Solutions Ltd	Data Engineer X 2 - Manchester. Our client based near Manchester are currently looking for 2 Data Engineers with Snowflake and AWS experience. The company is currently going through a large digital transformation, they are looking for talented Data specialist to help take the business up to the next level. This exciting new opening requires you to working closely with the Head of Data and CTO. As a Data Engineer, you'll work with enterprise-scale systems to help solve difficult problems, accelerate growth and add directly to the bottom line. You'll be responsible for delivering high-quality data outcomes via modern data sourcing, integration and modelling techniques, working as part of a Data team. You'll gain exposure to a wide range of modern technology (e.g. Snowflake, Databricks, Spark) and be continually learning. Requirements:*Strong experience with data analysis, data modelling (Kimball) and governance, with excellent analytical and problem solving abilities*Expertise using modern data tools (SQL, Python)*Snowflake and AWS experience preferred.*Good knowledge of Data Warehouses, ETL pipelines*Good knowledge of Cloud based environments - AWS and / or Azure *Good appreciation of the modern software development lifecycle, CI/CDData Engineer X 2 - Manchester - Snowflake, AWSIf you are interested in this position, please send your CV or call for more information.Data Engineer X 2 - Manchester - Snowflake, AWS	£50,000.00 - £60,000.00  per yearBenefits	Manchester, NW M11ED	Full Time, Permanent	6 Days ago	Computer Hardware; Computer Software; Computer/IT Services	Bachelor's Degree	nan	de6767889_1571299869
141	Data Architect Python SQL Azure - Client Server	Data Architect (Python SQL Azure TOGAF). Would you like to take ownership of large scale data projects across the full development lifecycle? As a Senior Data Architect at this start-up data technology / consultancy you'll work with enterprise scale clients to help them solve difficult problems, accelerate growth and add directly to the bottom line. You'll liaise directly with client stakeholders to understand their requirements and architect solutions, carry out data modelling and manage the project through to BAU. Clients range from industry leading public companies to innovative, high-growth start-ups within industries such as retail, eCommerce, FinTech and Gaming. You'll be based in Central London within a small team, start-up environment with little bureaucracy where you can make a real impact. Requirements:*Strong experience with data analysis, modelling and governance, with excellent analytical and problem solving abilities*Expertise using modern data tools (Python, SQL)*Experience of architecting large, enterprise scale data solutions; TOGAF certification nice to have*Ability to examine new data system requirements and implement data models*Good knowledge of cloud based deployments ideally within the Microsoft Azure stack*Experience of effective data architecture and modelling techniques (e.g. Kimball modelling)*Excellent communication skills, strong stakeholder management experience - ability to elicit requirements*Ideally you will have worked in a start-up environment previously and have experience of leading projects / teamsAs a Data Architect you will earn a competitive salary (to £120k) plus benefits.Apply now or call to find out more about this Data Architect (Python SQL Azure TOGAF) opportunity.	£90,000.00 - £120,000.00  per yearbenefits	London, London	Full Time, Permanent	5 Days ago	Computer Software; Computer/IT Services	Unspecified	nan	bb/14380/a/ks/111019_1570791355
142	Data Insight Manager - Vertex Resourcing Ltd	Data Insights Manager opportunity to work for an award-winning agency! Partnering very closely to an industry leading FMCG company.We are looking for someone with expertise within Data Insights, with extensive knowledge of the UK retail market. We need someone who can see beyond the obvious and recommend specific short, medium and long-term action plans across each operation: channel, retailer, field which will deliver improved results and return on investment for this specific industry leader.You must be confident in your ability to interpret data, make recommendations and be strategic in your approach when presenting back your findings to the client. This role will also come with two direct report, so ideally you will have man-management experience or the “want” to be a leader.We are looking for someone with knowledge in this space, confident, commercial, able to interpret date, make recommendations and use that insight to present back to the client in a strategic and slightly creative way.	up to £46,000.00  per year+ Car Allowance, Bonus & Package	Kingston Upon Thames, London KT2 6DZ	Full Time, Permanent	5 Days ago	Management Consulting Services	nan	nan	v9498
143	no_title	[]	[]	nan	nan	nan	nan	nan	nan	nan
144	Senior Data Scientist - MASS CONSULTANTS LTD	We are looking for a senior data scientist with 10 years’ experience in sonar signal processing and underwater acoustics to join a small team working on a variety of interesting signal processing, data analysis and mathematical modelling tasks. This will support underwater research carried out by the business.You will work as part of a small team of data scientists and sonar modelling experts undertaking signal processing and mathematical modelling tasks relating to sonar and the underwater environment. The work will range from modelling, through trials design to experimental analysis and algorithm design and the varied nature means that there will be opportunities to apply a range of novel mathematical and data science techniques to problems.You will also lead work packages throughout the project lifecycle and will be responsible for technical outputs and supervision of junior team members. The work will include bidding, working with customers to refine their requirements and using tools and developing software to undertake modelling and analysis and reporting findings.You will act as a domain point of contact taking the lead in developing the companies capability in the area and presenting it to a wider audience.Based at our head office near Frome, you may be required to work from our Bristol office on a temporary basis in support of a Project or Bid activities. You may also be required to travel for regular meetings with customers and external contractors and visits away for more than one day overseas may be required.We are looking for the following experience:Have 10 years’ experience in sonar signal processing and underwater acousticsBe familiar with software development practice in support of data science applicationsHave been responsible for delivering work packages and have experience of managing the customerHave experience in mathematical modelling and data analytics/visualizationSkills in C++ and Machine learning would be useful as would experience in radarMASS are an equal opportunities employer	£50,000.00 - £55,000.00  per yearplus company benefits	Beckington, SW	Full Time, Permanent	6 Days ago	Computer/IT Services	nan	nan	100sea
145	Data Entry - Extra Personnel	Data Entry We are recruiting for Data Entry in the Stafford area.As a Data Entry you will need to have:Good attention to detail.Experience in processing the orders.Able to work within in a teamPaySalary: £8.21Working Hours of Data Entry are Monday - Friday 6am till 2pm and 2pm till 10pm rotating shifts.Location: StaffordDuration: OngoingRole will be Data Entry, Warehouse SupportWorking as part of a team ensuring that all deliveries are correct and presentGood eye for detailMonday to Friday - Rotating ShiftsOngoing work with plenty of opportunity for overtime - This is an opportunity to work in the warehouse to gain extra hours.28 Holidays per yearWeekly PayPension SchemeEmployed StatusPersonal Accident Insurance Mortgage referencesMy Extra Rewards- An online portal offering vouchers and discountsIf you are interested in the above role please click apply.Please be aware that due to a large number of applicants you may not be contacted. If you have not been contacted within a week please give us a call on : 01922 322 122Extra Personnel Limited acts as an employment agency for permanent recruitment and employment business for the supply of temporary workers.	£8.21 - £10.80  per hour	Staffordshire, MID WS154RX	Full Time, Temporary/Contract/Project	5 Days ago	Travel, Transportation and Tourism ; Transport and Storage - Materials 	Unspecified	nan	chp_dearg_1570788272
146	Market Data Analyst (12m Maternity FTC) - BGC Partners	JOB SPECIFICATION The Market Data Business Analyst will be responsible for all vendor relationship management and the business interface for all aspects of Market Data for BGC Partners, Cantor Fitzgerald and our other affiliates. The employee will be responsible for MD Services all our offices in Europe, Middle East and Asia.   Mandatory Skills & Tasks Gather Market Data requirements (email, VSM, phone) and obtain the appropriate business approval.Place orders with vendors and instruct our Desktop team to arrange installation of services via a VSM ticket.Bloomberg webportal management for new orders, relocations, conversions and adding fee liable exchanges.Review and submit all contract cancellations to the vendors.Check the Bloomberg Daily Entitlement report.Arrange with vendors to provide user training sessions.Work closely with the Admin team to ensure the accruals and allocations are accurate.DACS / Open DACS administration and permissioning. Bloomberg EMRS administration and permissioning.Submit Bloomberg EMRS reporting each month.Submit direct billed exchange reporting each month.Prepare and submit Thomson Reuters quarterly DAD figures.Preferred but not essential Negotiate contracts, then submit to Legal dept for review/signing. Ensure the T&C’s meet our data use requirements.Review and communicate/provide guidance on contract licensing restrictions: Per entity, Desk, Location, Region. Understand and communicate to the business what enterprise data sources we have. Reference Data/Real-time feeds.Work with our Market Data Manager to regularly review that we have the correct licensing in place across the firm. To include potential data misuse, Non-Display/Derived data policies and Instrument Identifiers (SEDOL, CUSIP etc..).Produce ad-hoc reports and work with Desk Heads and Business Managers to reduce Market Data costs.Work with our Market Data Manager in preparing information for Exchange / Vendor audits. Run audit trail reports from DACS, EMRS & DART. Identify our applications and ensure that we have an application questionnaire completed for each. Collate our direct reporting exchange numbers from the various TCB reporting websites.        Key platforms/technologies  MDSLThomson      Reuters –TREP, Eikon, FXT & Thomson OneDACS / Open DACS API & EMRSBloomberg BPipe, Terminals &      Data LicensingFactset   PERSON SPECIFICATION Personal attributes The candidate selected must have a ‘can do’ attitude and be willing to work as an integral part of the Market Data Management global team.  Excellent communication skills with ability to deal with brokers, developers and Senior ExecutivesAble to work quickly and effectively under pressure A good team player with a flexible outlook  	[]	London City/Docklands, London	Full Time, Permanent	6 Days ago	Financial Services	Professional	Experienced (Non-Manager)	19003764
147	Android Engineer - TOMGANDHI CONSULTING LIMITED	No SponsorshipJob Title :-  Android EngineerLocation :- Warsaw/ Krakow, Poland Locations.Role :- Contract JD Experience and QualificationsSolid experience in mobile engineeringHands on experience on using Kotlin to develop Android AppExperience as a technical expert on the Android platform and competency with industry standard librariesShould have a good eye for design, should be able to implement latest Material Design components and animationsHave experience in Dagger2, Rxjava2, Retrofit2, familiar with third party lib integrationVery good with UI and Core Architectural Design patternsSolid experience in writing Unit Tests and UI tests, must be familiar with Junit, Mockito and EspressoExperience with source code versioning tools, specifically GithubFamiliar with security concept and integration is must, like  https, cert pinning, encryption and decryption and data protectionDeep experience working on a team of Android engineers building and maintaining large scale apps, or apps that you have built personallyStrong self-learning skillExperience in setting up CI is a plusContributions to open source projects is a plusEffective English communication skills in both written and verbalShould actively participate in design discussions and suggest improvementsExperience working in an agile development environment	[]	Warsaw, WIE	Full Time, Temporary/Contract/Project	6 Days ago	Computer/IT Services	nan	nan	nan
148	Data Analyst - Nigel Frank International	Position - Data AnalystLocation - St Ives (Cambridgeshire)Salary - up to £42kMy client are looking for an experienced and motivated candidate to join their highly qualified team of technical analysts and commercial specialists. You would be working for a construction materials specialist who supply most of the UK and Europe, and are rapidly growing their outreach.About the Job:Responsible for supporting and developing the Commercial SQL Server platformSupporting and developing the SQL Server database environmentInvolved in the strategic business intelligence and commercial journey of the companyResearching, identifying and utilising appropriate technical tool kits to deliver efficient analytical solutions to customersUtilising SQL Server knowledge providing efficiency and tactical solutions in a fast paced environmentRequirements:Power BIDAXSQLSSISMS ExcelMS AccessDesirables:Project Management experienceknowledge of Agile and Lean methodologiesBenefits:Training Scheme and eLearning solutionsPerformance Development Review Generous Pension Scheme25 days HolidayIf this opportunity interests you, and you believe that you've got what it takes to be a successful candidate, I would be more than happy to arrange a conversation with you to discuss this further. (I am Laura by the way!)You can call me on 01918147801, email me at l.leadbitter1@nigelfrank.com, or you can find me on LinkedIn (https://www.linkedin.com/in/laura-leadbitter-3b7aa7180/) 	£30,000.00 - £42,000.00  per year	Cambridgeshire, ANGL CB19AS	Full Time, Permanent	6 Days ago	Computer/IT Services	Unspecified	Experienced (Non-Manager)	data analyst -stives_1570096402
149	Data Scientist - Basingstoke - Spectrum IT	Data Scientist - Basingstoke - Python/ Maths/ Sensor projectsOur client, based in Basingstoke, is looking for a new Data Scientist with experience in Python and a passion for Maths to join their team focused on innovative projects surrounding sensors over a variety of different sectors. The team is a small but specialist and focused team in Basingstoke and has an amazing mix of working with experts in the field on international and leading projects but also being in a small team environment. Main Responsibilities: You will work in an interdisciplinary team alongside other signal processing experts and software engineers to design and develop data solutions including machine learning and signal processing techniquesDevelop data processing solutions for the high volumes of continuous data delivered by our instrumentsDeliver and present findings and results from data analysis to clients and internal managementExperience: You would have a good degree in computer science, IT, Engineering, Mathematics or similar.Ideally a PhD or Masters in a related field or 2 years relevant experienceExperience with Matlab and/or Python essentialExperience in Signal Processing is advantageousLinux or Unix operating system experience is desirableYou are engaged, creative, and self-reliant, with a solutionoriented approach.You are an excellent communicator - a cooperative and dependable team player - with excellent written and spoken English skills.What's in it for you?  Competative basic Dependant on experience of between £35,000 - £60,000Generous bonus package of up to 20% Annually Flexible core hour working scheme (As long as you are in the office between 10am and 4pm and work a full week, they don't mind when you start and finish) Matched pension scheme up to 5%Are you ready to play a BIG role in a small team instead of a SMALL role in a big team? Call Rachel on 02380 765 299 for more information or just click apply to be considered!	£40,000.00 - £50,000.00  per yearFlex Working, Bonus, Pension,	Basingstoke, Southern RG291BY	Full Time, Permanent	5 Days ago	Computer Software; Computer/IT Services	'A' Level/Higher or Equivalent	Experienced (Non-Manager)	vr/099791_1570176047
150	Data Analyst - Station10	We have a fantastic opportunity for a Data Analyst to join the team based in London. You will join us on a full time, permanent basis and you will receive a competitive salary of £35,000 - £45,000 per annum, depending on your experience plus benefits.Station10 specialise in providing high quality data solutions to a wide range of “big-name” clients across a variety of business sectors. These projects lead to long term and evolving relationships, in which we provide on-going strategic support and analysis to help increase customer engagement and improve business ROI.Benefits of joining us:- Company Bonus scheme and pension matching- Staff social activities- Great development programs - continuous training and education- Based in the heart of Farringdon- Cycle to work scheme- Healthcare- Pension scheme- 25 days holiday - with additional holidays added based on length of serviceApart from the usual corporate benefits listed above, we have a modern office in Central London. You will be within walking distance of loads of great places to eat, drink and be part of a sociable group.We’re a tight-knit team that focuses on supporting each other wherever we can, be that with skill sharing, training or just generally looking after each other. Being part of a small team provides a fantastic opportunity for both personal development and career advancement.The Data Analyst role:You will have a varied role working across multiple projects and work across several clients to provide actionable insights and bespoke strategic solutions, so no two days are the same.  You will have a fantastic opportunity to define and shape multichannel data strategies for leading enterprises, and will play a vital role in the growth and strategic direction of our company.Key responsibilities of our Data Analyst:- Digital Data Strategy & Planning- Measurement Requirements Definition- Data Implementation & Maintenance- Data Auditing- Optimisation Analysis and Management- A/B & Multivariate Testing & Ongoing Optimisation- Data Experimentation & Investigation- Multichannel Deep-Dive Insight- Segmentation Analysis and Statistical Analysis- Correlation Analysis & Algorithm Development- Emerging Measurement Techniques and Analytical Methods (R, Python)- Big Data Technologies (Hadoop, Syntasa, AWS, Adobe Data Workbench)- Analytics and Insight Evangelism and TrainingWhat we’re looking for in our Data Analyst:- Degree educated in a numerical or science discipline- Strong learning agility with enthusiasm to learn and develop new skills- At least two years of working with digital analytics tools, such as Adobe Analytics, Google Analytics, WebTrends Infinity, IBM CoreMetrics preferable- Experience of working with digital optimisation tools: Adobe Target, Google Optimiser, Oracle Maxymiser, Optimisely- Experience in advanced web analytics methodologies such as experimentation and testing, competitive analysis, surveys and market research- Familiarity and/ or implementation experience of digital data collection techniques and limitations- Confident communication skills, able to translate complex information into concise and usable insights across a diverse stakeholder group though a variety of means (visual, verbal and written)- Advanced skills using the Microsoft Office suite with very strong Excel, Word and PowerPoint skills- Technical understanding of HTML and web applicationsWe’re small but we’re growing and we move fast – job roles with us are varied and broad ranging, so there’s always new stuff to learn and new stuff to do. Want to be a part of it? Click ‘apply’ now to become our Data Analyst – we would love to hear from you!	£35,000.00 - £45,000.00  per year	London, London EC1N	Full Time, Permanent	5 Days ago	Business Services - Other	nan	nan	jd1710dalon
151	Data Architect - Global Insurance Company - Ashdown Group	Data Architect - BirminghamA large global company within the insurance sector are looking for a Data Architect to join their team in Birmingham. This Data Architect role is paying a starting salary of £60,000 - £80,000 based on experience plus an exceptional benefits package.The Data Architect will be responsible for:- Guiding and shaping of data solutions across the business and aligning solutions with overall technology strategies- Working closely with business stakeholders from ideas stage through to delivery, analysing business requirements and ensuring solutions meet business needs- Owning corporate data and data security models- Challenging IT solutions- Documenting of data architecture designs and decisions- Set data architecture principles- Define how data is stored and securedTo be considered suitable for the Data Architect role you will ideally have previous experience of data architecture from within the financial services and/or insurance sector along with the following:- Knowledge of frameworks such as TOGAF, Zachman and PEAF- Proven experience of delivering scalable, robust and secure data solutions- Strong understanding of information management practices- Experience of business re-engineering principles and processes- Ability to translate business needs into solutions using varying modelling tools.To apply for this Data Architect role please send a copy of your CV quoting reference number ASH17960CHThe Ashdown Group Ltd acts as an employment agency in respect of permanent vacancies and as an employment business in respect of temporary vacancies.	up to £80,000.00  per year	Birmingham, MID B46UD	Full Time, Permanent	5 Days ago	Computer Software; Computer/IT Services	Unspecified	nan	ash17960cho45y_1571388790
