	title	description	salary	location	jobtype	duration	industry	education	career	ref_code
67	Data and Portfolio Manager - Big Society Capital	"Job Title: Data and Portfolio ManagerLocation: London, EC4AAccountable to: Data and Portfolio DirectorDirect Reports: Data and Portfolio DirectorJob Category/Salary Band: £46,000k - £50,000k per annum, depending on experience. Overall Purpose of the Role:Assist the Data and Portfolio Director in DPD, ensuring that Big Society Capital manages data and systems effectively in order to produce accurate, timely and strategic management information to be used in external and board reporting. In an emerging market this data will be a crucial driver of Big Society Capital and our partners’ learning, decision-making and strategic planning. Statement of Responsibility:Fluid responding to business needs but willing to include elements of:DataAssist the DPD to meet BSC’s data requirements, including establishing priorities, planning systems and process changes and efficiently implementing these changesExpand the volume and improving the quality of data on social investment activity and performanceEnsuring that information and data stored on Salesforce and other management information systems is up-to-date and accurateUsing Tableau to present data clearly - allowing users to have insight into Social Investment through the Data Dives blog seriesDeveloping the methods used to collect and understand social impact dataConnecting social investment data to relevant data sets in order to gather and share insightsSalesforce ManagementAssisting with Salesforce and Salesforce Community platforms ensuring both systems are fit for purpose and operating effectivelyCo-ordinating the use of salesforce across the office (e.g. pipeline, strategy & origination projects)Offering immediate helpdesk support and training to internal staff and intermediariesEnsuring Salesforce is meeting the needs of each department: Investment,Portfolio Management SupportHelping to embed portfolio management processes across the Investment group, ensuring that this is consistent across the portfolio and through timeWork with DPD on the preparation of the quarterly board and portfolio performance dashboardsSupporting the Investment group with portfolio management requirements, including preparing valuation papers, monitoring milestones, RAG rating and IRR updateSetting up process and systems to share learning across the portfolioTracking submissions and maintaining a record of monitoring reporting from IntermediariesSupport and assist the work on investment pipeline, including the whole investment life cycleIntermediary DevelopmentSupport all processes for intermediary development, including the Building Blocks toolMonitoring agreed action points coming out of the Building Block reviewsSetting up process and systems to share learning between intermediaries Person ProfileMandatory experience required for the role: At least 6 months experience in data management gained whilst working for financial institution.At least 6 months experience with CRM software ""Salesforce"" including; back end architecture expertiseExperience and competency in analytics software ""Tableau"" for data visualisation (including mapping)Strong project management skillsA background in work experience relevant to Big Society Capital objectives (such as government, social enterprise, finance or Investment)A passion for and demonstrable commitment to Big Society Capital's social mission and the UK sectorMandatory skills, abilities and attributes required for the role: Bachelors degree or equivalent from a leading or recognised computer science universityPeople influencing skillsStructured thinker able to deal with complexity and uncertaintyAttention to detailAbility to work towards a bigger vision, which may be a moving targetExperienced in Adobe PhotoshopProficient in Microsoft Office (excel, word, powerpoint)Experienced in Illustrator Coding - HTML, CSS, Javascript, Python HOW TO APPLYSALARY AND TERMS OF EMPLOYMENTThis a permanent, full time role.Salary - £46,000k - £50,000k per annum, depending on experience.We are an equal opportunities employer. APPLICATIONS - VIA EMAIL ONLY!Please apply by sending your CV and Cover letter of no more than 2 pages to jobs@bigsocietycapital.com CLOSING DATE FOR APPLICATIONS IS THURSDAY 31ST OCTOBER 2019"	£46,000.00 - £50,000.00  per year	London, London EC4A 1AZ	Full Time, Permanent	5 Days ago	Government and Public Sector	nan	nan	nan
68	Data Tester - Lorien Resourcing Limited	Data Tester - Permanent Role - London BasedMy global client is looking for a Data Tester to come on board within their expanding team and assist in the growth of this even further at a real exciting time. This is a fantastic opportunity to join a leading company that will offer you the chance to enhance leadership skills and develop your experience and offers clear lines of career progression into a management role in the future.In this role you will be working alongside Data developers and other members of the scrum teams to design, develop and conduct data testing throughout the project lifecycle.Main responsibilities include: Author test scenarios, test cases, and test scripts to validate target and source data.Perform data reconciliations between different parts of the same system and between systems.Assume ownership of test artefacts such as data configurations, bugs, acceptance criteria and pass/fail conditions.Executing all levels of testing (Exploratory, System, Integration, and Regression).Using defect tracking systems to report issues to the development teams and working with them to satisfactory issue resolution. Including providing where relevant annotated screenshots, log files and detailed steps to reproduce any reported issues.The ideal candidate will have: In-depth SQL Knowledge for verifying data.API Testing.Exposure to Scrum/Agile delivery methodologies.Experience in testing non-functional requirements and exploratory testing.Experience of standard defect test management software, such as JIRA, Quality Center etc.The Data Tester role comes with a competitive salary along with: 25 days holiday + bank holidays Company pension scheme Private medical insurance Employee assistance programmeLife assurance If you are an individual with strong leadership skills, click apply and I will give you a ring to discuss the job opportunity.We are an equal opportunities employer and welcome applications from all suitably qualified persons regardless of their race, sex, disability, religion/belief, sexual orientation, gender reassignment, marriage and civil partnerships, pregnancy or maternity or age	[]	London, London W1D1NN	Full Time, Permanent	5 Days ago	Financial Services	Unspecified	Manager (Manager/Supervisor of Staff)	50201587_1570810463
69	SQL Developer - SSIS/Data Warehouse - Stoke-On-Trent - Crimson Limited	SQL Developer - SSIS/Data Warehouse - Stoke-On-Trent SQL Developer required for a leading organisation based in Stoke-on-Trent town centre, where you will be responsible for assisting the continuous high-quality data management across the company.The ideal candidate will have experience of identifying and implementing appropriate tools and technique to enable transactional data to be transformed into consumable information to advise decision making within the business.Key responsibilities of the role:Support the business intelligence and data manager to build and manage the BI platform so the business data analyst requirements can be retrieved, stored and viewed efficiently.To support department data initiatives which help to inform the overall strategic direction of the businessTo be an advocate of data governance activities, policies and proceduresTo help drive continuous improvements in data quality standardsTo maintain records of data owners and stewards in the business, tracking data usage, and ensuring they are aware of their obligations in relation to data managementTo assist with the resolution of known data issues, ensuring root causes are identified and sustainable solutions are developed and implemented, liaising with IT to fix issues, as requiredTo assist with data risk prioritisation and reportingKey Skills of the role: Previous experience in BI/SQL development roleExperience of data quality management conceptsExperience of T-SQLExperience of SSIS/SSRS, ETL and data warehousingProactive problem-solving skillsDetailed data analysis and presentation skillsExcellent communication skills, able to translate technical detail into simple language that non-technical people can understandAble to operate in a fast-changing market and environment, often tackling issues without clear precedentsOrganised, methodical, able to deliver to agreed deadlinesConfident in own judgement and decision-making, sees challenges as development opportunities not problemsSalary The salary for this position is up to £42,000 per annum, depending on experience, plus benefits.Interested?! Send your up to date CV to Kate Sadler at Crimson for reviewNot interested?! Do you know anyone that might be? Refer a friend for this role to earn £250 worth of vouchers. http://info.crimson.co.uk/referafriendCrimson are acting as an employment agency in regards to this vacancySQL Developer - SSIS/Data Warehouse - Stoke-On-Trent 	£36,000.00 - £42,000.00  per year	Stoke on Trent, MID ST41NB	Full Time, Permanent	2 Days ago	Computer/IT Services	Unspecified	nan	pr/cr/010099_1569836999
70	Data Architect - OHO Group Ltd.	Data Architect Fast-growing BioTech start up are looking for experienced Data Architect whose highly skilled in combining sophisticated computational methods and a wide pharmaceutical expertise to identify drug treatments for rare illnesses. Treatments to be found in a fraction of the time and cost to traditional methods! A Data Architect would be responsible for leading a team that builds robust and scalable data solutions.  The ideal candidate will be:A graduate in relevant science, technological or mathematical disciplines.5+ years experience in computational solutions.2 years line-management experience in relevant sector,Experience in working with biological data and challenges of data integration.Programming skills in Python, used of relational and NoSQL databases.Cloud computing experience.This is a huge opportunity for Data Architects passionate about applicating their engineering skills. Interviews are being conducted, so apply now! Keywords: Data Architect, Python, technology, AI, NoSQL, software, cloud, AWS, Biotech, Data Architect	£45,000.00 - £60,000.00  per year   Benefits: Amazing company benefits	Cambridge, ANGL	Full Time, Permanent	5 Days ago	Architectural and Design Services; Computer/IT Services	nan	nan	oho ede p4
71	Data Engineer SQL Python Cloud - Client Server	Data Engineer (SQL Databricks Python Cloud AWS Azure). Would you like to work on complex and interesting systems that provide daily challenges; collaborate with a friendly and upbeat team and improve your skills via continual learning programmes whilst enjoying a good work / life balance?As a Data Engineer at this start-up data technology / consultancy you'll work with enterprise scale clients to help them solve difficult problems, accelerate growth and add directly to the bottom line. You'll be responsible for delivering high-quality data outcomes via modern data sourcing, integration and modelling techniques, working as part of a small delivery team and also often within the client team too. Clients range from industry leading public companies to innovative, high-growth start-ups within industries such as retail, eCommerce, FinTech and Gaming. You'll gain exposure to a wide range of modern technology (e.g. Snowflake, Databricks, Spark) and be continually learning. You'll be based in Central London within a small team, start-up environment with little bureaucracy where you can make a real impact. Requirements:*Strong experience with data analysis, data modelling (Kimball) and governance, with excellent analytical and problem solving abilities*Expertise using modern data tools (SQL, Python)*Good knowledge of Data Warehouses, ETL pipelines*Good knowledge of Cloud based environments - AWS and / or Azure *Good appreciation of the modern software development lifecycle, CI/CD*Excellent written and verbal communication skills*Ideally you will have worked in a start-up environment previously and have experience of leading projects / teams*Degree educatedAs a Data Engineer you will earn a competitive salary (to £90k) plus bonus and benefits.Apply now or call to find out more about this Data Engineer (SQL Databricks Python Cloud AWS Azure) opportunity.	£70,000.00 - £90,000.00  per yearbonus + benefits	London, London	Full Time, Permanent	2 Days ago	Computer Software; Computer/IT Services	Bachelor's Degree	nan	bb/14240/a/ks/141019_1571038493
72	Data Analyst - SHORTLIST RECRUITMENT LIMITED	Data AnalystChester£40,000ShortList Recruitment are working with a fantastic company based in Chester who currently have a requirement for a Data Analyst. The Data Analyst will have experience working within a customer facing operational environment reporting and forecasting data. The main focus of this role is to discover and supply data to various departments in order to support business decisions. Key responsibilities for the Data Analyst are:Technical proficiency data interpretation, writing SQL queries and ability to extract data from multiple sourcesCreate and manage a range of reports, both internal and external, handling customer and company data Bring flare and insight to data which can be utilise statistics which could be used for PR or planningInvestigate and supply solutions for data issuesExcellent analytical skills along with the ability to collect, organise and analyse large amounts of dataAbility to understand a problem and correct it in a timely fashionThe Data Analyst will enjoy working with data on a daily basis, analysing and discovering trends and using the data to enhance various KPI's within the company and their client data.The Data Analyst role will reward the right candidate with a salary of up to £40,000 and is easily commutable from Chester, Wrexham, North Wales, Cheshire and Liverpool.Click APPLY NOW for immediate consideration!	[]	Chester, NW CH1	Full Time, Permanent	4 Days ago	Financial Services	nan	nan	205199000019843977
73	Data Solutions Architect - Triad Group Plc	Data Solutions Architect - ETL, Big Data, MDMOur globally renowned client is looking for a Data Solutions Architect to join their team initially until the end of the year. You will be responsible for developing the existing strategic IT roadmap so that it fits within the business requirements and IT transformation plans. You will also define innovative fit for purpose Data Solutions for assigned projects.You will use your experience of Data Modelling, ETL, Big Data and Data Integration while working alone and when engaging with various project teams to deliver a wide range of complex projects.You will have the following skills and experience:Experience with MDM, Data warehousing, big data technologies.Experience of application, data and infrastructure architectures.Data Governance skills.Experience of B.I tools like Business Objects, Qlikview, SPSS.Big Data tools set experience.Successfully operated and influenced at senior levels.Management of and working with 3rd party suppliers.Other informationIf this role is of interest to you or you would like more information, please contact Ben Fowler or submit your application now.Triad is an equal opportunities employer and welcomes applications from all suitably qualified people regardless of sex, race, disability, age, sexual orientation, gender reassignment, religion or belief.Triad Group Plc acts as an Employment Business for this contract position.	£550.00 - £585.00 /per day	Milton Keynes, HC MK109AF	Full Time, Temporary/Contract/Project	5 Days ago	Internet Services	Unspecified	nan	cr/005011_1569594734
74	Business Analyst (Data Management) - Potters Bar - Ashdown Group	Business Analyst (Business Data Management) - Potters Bar, HertfordshireA large and successful organisation is looking for an experienced Business Analyst to join its team in the Potters Bar area of Hertfordshire / North LondonThis role will focus on establishing the organisational information requirements, value of data and data management / processing practices. Day to day duties will include:- Improve business performance by analysing requirements; designing solutions; recommending system controls and protocols for the Aconex system and associated product suite.- Working with the business to maintain and improve data acquisition, processing and reporting.- Map current and future business data requirements- Establish cost and value of data- Put in place and maintain cost effective data management disciplines and practices- Determine operations objectives- Design work processes and workflows- Adopt an Agile management approach to project deliveryThis Business Analyst role is paying a starting salary of £50,000 - £55,000 plus benefits, based on experience. To be considered suitable you will need to have the following skills and experience:- Strong business analysis experience including data management- Software requirements gathering, design, development, documentation and implementation- Supporting existing solutions including investigating and resolving defects- Analysing business needs and information- Understanding testing process- Experience with business intelligence tools, GiS solutions, Visio, SharePointTo apply for the Business Analyst position please send a copy of your CV quoting reference ASH18080CH The Ashdown Group Ltd acts as an employment agency in respect of permanent vacancies and as an employment business in respect of temporary vacancies.	£50,000.00 - £55,000.00  per year	Hertfordshire, HC EN65AE	Full Time, Permanent	2 Days ago	Computer Software; Computer/IT Services	Unspecified	nan	ash18080chrr1_1570439330
75	Graduate Account Manager - IT Data Systems - BMS	This global leader is looking for five Graduate Account Managers to join its training academy. As an international business, they offer structured graduate sales training along with limitless career potential. The Role: You will join an academy style programme and receive both classroom and on the job training to help you get up and running in your first six months. As a Graduate Account Manager, you will be responsible for managing and developing an existing client base which will include IT distributors and installers. Dealing with both commercial and technical teams you will help on technical enquiries, up-sell new solutions and win new projects.The Company This international business is a major name in the design, manufacture and supply of specialist IT data networks. Employing more than 5,000 people worldwide they offer bright and ambitious graduates prospects to progress their careers internationally.Responsibilities as a Graduate Sales Executive will include:Managing existing clientsDealing with distributorsWorking to monthly sales targetsWorking alongside field sales teamFor this Graduate Sales position, we are looking for individuals who meet the following criteria:Graduate calibreEnthusiasticAmbitiousCompetitiveThe Package for this Graduate Sales role:£28,000 BasicPlus 20% BonusBenefits	£25,000.00 - £25,000.00  per year20% Bonus, Benefits	St Albans, HC WD171AF	Full Time, Permanent	2 Days ago	Other/Not Classified	Unspecified	nan	jn -072018-143040_1571644853
76	Windchill Consultant - ELOI CONSULTING LTD	This resource should be very strong with Windchill Customizations, Data/Migration related issues,experience with CREO & CATIA Workgroup Manager,experience with PDMLink, ProjectLink, the overall Solution Architecture, andexperience with Oracle ERP ad related integrations.Strong Communication skills is critical. Experience in Windchill Implementations .• Able to define solutions for PDMLink, ProjectLink & other Windchill Modules.• Experience in Data Migration and Windchill Up-gradation.• Experience in PDMLink/J2EE development, application workflow development and testing.• Developing new functionalities, and performing UT,IT and System testing.• Prepare technical solution for new functionalities and Implementations.• Experience in Integrations from and To Windchill.• Experience in Core Java, JSP, JDBC and struts.• Experience on builders, data utility, form processors, validators, listeners etc.• Strong Experience in application workflow development & testing.• Strong Experience in software configuration management using both clear case and svn• Strong Experience in (automatic) unit testing (Junit)• Experience in migrating and testing from existing to new technical solution• Experience in integration testing using HPQC• VM/PDMLink/Oracle installation/configuration capabilities.	up to €60,000.00  per year	stuttgart, Baden-Württemberg	Full Time, Permanent	6 Days ago	Computer Software	nan	nan	nan
77	Client Data Administrator (Financial Services) - Ashdown Group	Client Data Onboarding Associate / Account Handler (Large Wealth Management Firm)A large financial services company based in the City is looking for a Client Data - Onboarding Associate to join its team.Working as part of a friendly and supportive team your role will be to:- Maintain data relating to Wealth Management Accounts- Ensure data tasks meet standards- Ensure data is correct and accurate- Advising on account opening and maintenance matters- Identifying areas of risk / concern- Review practices and proceduresThis Client Data Onboarding Associate is paying a starting salary of up to £29,000 based on experience. An excellent benefits packages is also available including 25 days annual leave, annual bonus, healthcare and superb pension.To be considered suitable you will need to have previous administration experience, ideally within financial services however that is not essential. You will also need strong IT skills, excellent communication skills and proven accuracy and attention to detail. To apply for this client Data Onboarding Administrator please send a copy of your CV quoting ASH18090CH The Ashdown Group Ltd acts as an employment agency in respect of permanent vacancies and as an employment business in respect of temporary vacancies.	up to £29,000.00  per year25 days holiday, bonus, healthcare	City of London, London	Full Time, Permanent	2 Days ago	Banking and Consumer Lending; Accounting and Auditing Services; Financial Services	Unspecified	nan	ash18090ch13g_1570439079
78	Lead Data Engineer - McGregor Boyall	Type - PermRole - Lead Big Data Engineer Salary- £70,000 - £80,000Location - Nottingham Lead Big Data Engineer - UK - Nottingham - Big Data - Java - Cloud (AWS, GCP or Azure) - Financial Services   Our global financial services company are looking for an analytical individual who has extensive knowledge surrounding big data technologies such as spark and kafka. The role will entail coding with java and has huge amounts of exposure to the cloud.The lead engineer will have access to cutting edge technologies and the major organisation are continually evolving their platform and capabilities Required skills (at least 3 skills of the following):Big Data (Hadoop or Spark)JavaC++AWS, GCP or AzureManagerial or leading a team experience Key Activities: Developing complex software components and frameworks to help deliver new solutions to businessSolution design and implementationIdentify short and long-term solutions that analyse risk assessments, opportunities for business using technologyPlease apply to the ad and send your latest CV to zbinge@mcgregor-boyall.com   by 24th September 2019 (12PM).   McGregor Boyall is an equal opportunity employer and do not discriminate on any grounds. 	£70,000.00 - £80,000.00  per year	Nottingham, MID NG12AP	Full Time, Permanent	2 Days ago	Computer Software	Secondary School or equivalent	Experienced (Non-Manager)	bbbh148052_1571074230
