	title	description	salary	location	jobtype	duration	industry	education	career	ref_code
206	Data Scientist and Operations Lead - Creative Personnel London	Data Scientist and Operations Lead   BackgroundWe are looking for an experienced hands-on data scientist to lead the data science thinking and practice. The role is based in the worldwide team in London, with responsibilities to support other markets.   This role requires a curious and creative mindset to become an engine of change, while also a structured approach to support effectively global and market needs and spread state-of-the-art data science practices. The internal stakeholders are clients, account teams, digital execution teams, analytics practitioners and media analysts. The external stakeholders are clients and partners. It is also expected that the candidate can support and contribute to the overall data strategy in collaboration with other stakeholders, which entitles foster partnerships/initiatives with start-ups, universities, open-source groups, etc.Responsibilities DeliveryEnsure on-schedule development of pre-agreed list of analytics solutions, and provide inputs for development of new solutions based on client and internal teams requirements - from prototypes to fully fletched solutions (we have resources to help on this)Coordinate the cloud-tech offering for data practitioners in collaboration with our data engineer, including driving best practices, standardisation and collaboration across the data scientists in the networkScout for state-of-the art technology/data-science practices/models or algorithms, and assess how can they impact the business (e.g. Deep ML and AI)Work with internal and external stakeholders to address their challengesDevelop analytics tools and solutions and coordinate their maintenance with Tech team  SupportWork with the wider business to foster the value of the data science practice. This includes the impact of branding and performance in the digital and offline worldAssist markets with their data analysis initiatives, either to get control of their data or apply new techniquesDrive thought leadership for application of data science for the media industry, including digital analytics, addressable media, consumer behaviour, automation, etc.Support on scouting opportunities for new-business pitches and proposalsSupport senior leaders to maintain and implement an overall data strategy  Skillset RequirementsExpertise and experience inCoding in Python (a must) and R. Other languages are desired as well but optional (Scala, Java script, etc).Fast prototyping of products solutions using open source technology for scalable pipelines (Spark, R-shiny, Dash/Flask, Play environment, etc.)Managing, accessing, querying structured/unstructured data bases (SQL, Hive, Mongo, etc.)Knowledge of modelling solutions (e.g. attribution) and Experimental designs (e.g. A/B and Multi-Variate testing) to support business decisionsA good understanding ofBig data analyticsDigital media datasets (Ad Servers, DSP, DMP, AdWords, Viewability, Cross Device etc.)Commercial awareness, client/stakeholder handling and strong written and oral communication skills  Desired experienceMedia planning and marketing (including digital media across programmatic, search and paid social)Building and rolling out large-scale analytics initiatives within a global networkManaging complex, multiple stakeholder engagements, in a fast-paced organizat   ________By applying for this job, you are choosing to accept Creative Personnel's Terms & Conditions. At Creative Personnel we process certain personal information about you for our legitimate business interests in order to identify and contact you about suitable positions that may be relevant to you. Details are set out in our Privacy Policy. 	£65,000.00 - £75,000.00  per year   Benefits:	London, London	Full Time, Permanent	4 Days ago	Other/Not Classified	nan	nan	alexe23
207	Senior Data Engineer - X4 Group Ltd	 Multiple Mid-Level and Senior Data Engineer  positions open for FinTech client in Central London.New requirement for Mid and Senior Data Engineer professionals to join a small, passionate team of expert technologists and finance specialists. This FinTech are specifically targeting and helping small businesses with their cashflow problems.You will be part of building out a green field microservices backend, and working collaboratively with a strong team of data engineer and data scientist staff. They have a cross functional team and work closely on these projects so you will get exposure to the day to day of different professionals and also exposure to new technology stacks.Mid-Level and Senior Data Engineer - Skills:•Experience with deployment pipelines and continuous delivery on cloud platforms (Google Cloud Platform, Amazon Web Services, Docker)•Comfortable using Python, Java or Scala in production with an eye for quality and experience in data streaming•Good at data modelling and data migrations•Desirable: created complex data processing pipelines in a production environment, ideally streaming on Google Cloud Platform with systems like BigQuery, Kafka, Beam, any other streaming platform.Mid-Level and Senior Data Engineer - Role:•Building a real-time event driven architecture, using modern ETL tools and cloud infrastructure•Building data pipelines for the ever increasing flow of data•Building robust, secure and maintainable API to serve data.We are looking to line up interviews as of immediately, so if you are interested in hearing more about these positions and organisation, please don’t hesitate to apply.Location: Central LondonEmployment: PermanentExperience: Mid-level AND Senior Data EngineerSalary: £60,000 - £100,000 (depending on experience)Sponsorship: Not available  	£60,000.00 - £100,000.00  per year	London, London wc2r	Full Time, Permanent	5 Days ago	Computer Software	nan	Experienced (Non-Manager)	kp1333
208	Data Entry Administrator - Rark Solutions	Rark Solutions are supporting a market leading company in West Malling who are recruiting for 2 Administrators.The role is a 6 month contract.The role has the responsibility to support the sales team and ensure they are able to make more sales and build better relationships with their clients.You will be reporting into the Sales office manager and will be responsible for the following:Checking files are compliant and up to dateDelivering outstanding service to colleagues and clientsCompleting paperwork and re-directing it to the relevant dept.Scanning and checking files onto the company databaseOther ad-hoc admin dutiesWe are looking for a candidate who is pro-active and positive with excellent communication skills. You should be flexible and willing to go the extra mile to help colleagues. The ability to work in a fast-paced environment would also be a strong advantage.In return you will be offered an good basic salary with the a development plan in place from your first day. The company offers free car parking and are very close to the train station.Interested? Apply online today.	£17,000.00 - £17,000.00  per year	West Malling, Southern me19	Full Time, Temporary/Contract/Project	5 Days ago	Other/Not Classified	nan	nan	mp25008ct932-977
209	Data Engineering Manager - Nationwide	Job description• A Data Engineering Manager in our head offices in Swindon• Permanent 35-hour per week contract• Send in your application by ASAPNationwide has recently launched a new data strategy which will transform the way the society thinks about, values and manages its data. As part of this new strategy the data & analytics community, and more specifically, the data solutions team has a number of exciting new roles to help deliver on the promises of reducing the number of legacy data stores, simplifying the architectural landscape and treating data as a valued asset.This role will focus on building and managing high performing teams tasked with delivering reporting and analytical solutions onto the data lake and data warehouse. The role will also focus on helping establish an in-house engineering capability and being an active part in driving forwards the data and analytics strategy of the society.Combining accountabilities for capability build, continuous improvement and automation, this exciting new role will provide the opportunity to work with some innovative and driven people, industry leading vendors and help shape and drive the next phase of the strategy execution.Who we're looking forAs a minimum requirement you’ll:• Be a strong leader with a deep technical understanding as well as an ability to create and motivate high performing teams• Have an Agile mindset, happy to embrace change and be able to instil these values in your team• Have significant experience of data lake and data warehouse delivery gained in a mix of industry sectors• Be a technical innovator with a curious mindset and a thirst for knowledge• Working hand in hand with our business teams, you will have excellent stakeholder management and influencing skillsIt would be nice if you also had:• Experience of working in an Agile environment using SCRUM/Kanban• Have worked in the financial sector for part of your career to dateWhat you'll be doingReporting to the Snr Mgr Data Engineering, your primary objective will be to create and manage effective teams of data engineers delivering high quality solutions onto the Hadoop and Teradata IM platform.You will be asked to help drive our capability strategy combining the sourcing of external talent from other industry sectors with the development of our current engineering people helping them to embrace new skills and methods and help other Nationwide people gain opportunities within Data Engineering.Having a positive mindset which embraces change you will play a key role in leading the teams transformation towards Agile techniques, helping to create a culture of innovation and driving an automation first mindset.With line management accountability for up to 8 people you will work with your team of engineers to develop effective and measurable objectives, track and enhance performance and ensure the Data Engineering team builds a strong internal reputation for high performance.Working with the Data Engineering leadership team, your peers, you will play a central role in ensuring the team is scaled and ready to meet the significant and growing demands of the organisation. This will mean you playing a central role in forecasting, planning and developing an engineering roadmap and driving value from our vendors and other external capability.Apply nowThe extras you'll getIf you put a lot in, it’s only fair you should get a lot out. So if you help us do the right thing for our members, we’ll help further your career with us. As part of our team you’ll get:Access to training to help you progress and develop your technical skills and careerPension scheme where if you pay in 7% we’ll top it up to 23%Life assurance worth 8x your salary24 days’ holiday plus bank holidaysThe ability to 'buy’ up to 10 days more holidayFlexible benefits scheme giving you access to discount vouchers at various retail outletsAccess to a Healthcare schemeAccess to an annual performance related bonus scheme	[]	Swindon, SW	Part Time, Permanent	4 Days ago	Other/Not Classified	nan	nan	mp26397ct1240-r002801208
210	Data Architect - IT Executive Group	Data ArchitectA great opportunity has arisen for a Data Architect in London, to work within a startup environment. The Data Architect will need solid knowledge of relevant technologies including SQL, building ETL processes, administering databases, creating / designing databases, Tables, Backup and Clustering. All Data Architects must either be degree educated, hold professional qualifications or can demonstrate relevant experience.This Data Architect role will suit someone who has a background working as a Database Developer. The Data Architect will have strong customer focus, stakeholder management skills and work well under pressure. Key Skills:*Relational Database skills (MS SQL Server)*Azure Services*Open source technologies including Elasticsearch*Proven big data experience*Strong communication and presentation skills*Working with Agile principles*Development tracking tools like Trello, Jira*Experienced user of Excel including experience of data manipulation and the integration of Excel with SQL Server databases*XML *Java*Visual Studio*Visual Basic*Python*Experience of MVC or other structured software development patterns.Experience:*Passionate about technology and excited by the prospect of working with an innovative start-up*Experience of working within a development team *Ability to apply logical thinking to complex data problems *Strong internal customer service ethic with a focus on service delivery*Documentation skillsIt is essential that all Data Architect have attention to detail and good organisation skills. You will be an individual who wants to make an impact and thrives on success. For the successful Data Architect, we offer a competitive package along with excellent career opportunities. For more information please contact graham@it-executive.com   or call 01908 506 506 IT Executive Group is acting as an Employment Agency in relation to this vacancy.	£70,000.00 - £80,000.00  per year	City of London, London	Full Time, Permanent	6 Days ago	Computer Software; Computer/IT Services	Unspecified	nan	gf0910/arc/2609_1569513284
211	DevOps Engineer for Sports Data Product - Work in Lithuania	Work in Lithuania is a programme that is aimed at encouraging professionals living abroad to build their careers in Lithuania.Our partner – Genius Sports – is looking for an specialist who will report into the DevOps Manager, will be joining a company that uses Agile methodologies (Scrum and Kanban) in both the development and IT Operations teams. The specialist will collaborate closely with both groups to meet release deadlines. The specialist will play a key role in ensuring frequent releases as Genius Sports continue to reduce cycle time, de-risk future releases and provide quick ROI.MAIN RESPONSIBILITIESPassion for automation, simplicity, consistency, security, availability, and scalability of systemsStrong sense of ownership, drive and an obsessive attention to detailWork integrated with the development and product teams to ensure high performance and reliability across all tiers of the stackHelping improve our infrastructure platform, by automate the manual maintenance tasks and increase efficiencies with the AWS CloudGuide project teams through the technology selection and architecture/security governance processesDesign, enable and optimize CI/CD pipelines for dev teamsLend DevOps expertise to other teams to help track down performance/stability problems REQUIRED SKILLSExperience with Linux & command line skills (cross-platform skills a bonus)Comfortable with AWS cloud servicesAt least one infrastructure language (Cloudformation, Terraform)Understanding of networking protocols like HTTPS, DNS, TCP/IPCode and scripting – proficient in at least one programming language (C#, Node, Python, Go, Ruby)Docker and containerization (Linux)CI and Build automation – GitLab ideallyExperience with application performance monitoring tools, centralized logging and alerting systemsWilling to keep learning new tools and languages DESIRABLE SKILLS.NET applications deployment experienceExperience with Kubernetes, EKS, ECSExperience with a serverless stack (preferably AWS Lambda)Good understanding of SQL and NoSQL databases (data modeling, data warehousing)Experience working with cloud-based data solutions (e.g., AWS, EC2, EMR, RDS, and Redshift)COMPANY OFFERSA fun, relaxed and stimulating working environment in central VilniusCompetitive salary – negotiable, based on experienceExcellent career development opportunitiesBusy social calendar	[]	Vilnius	Full Time, Placement	8 Days ago	nan	nan	nan	nan
212	MI Data Analytics Analyst - McGregor Boyall	MI Data Analytics AnalystOur client, a financial services group is seeking an experienced MI Data Analytics Analyst to join the team based in the London.Required experience: Produce and develop regular and meaningful MI reportsExtract data and produce agreed reporting dashboards to relevant stakeholdersProduce weekly / monthly Data Integrity reportsRespond to all ad hoc reporting requestsTechnical skills:Data AnalysisSQLBusiness ObjectPower BIR knowledgeCustomer focusedMcGregor Boyall is an equal opportunity employer and do not discriminate on any grounds. 	£40,000.00 - £48,000.00  per yearBenefits	London, London	Full Time, Permanent	6 Days ago	Banking and Consumer Lending	Unspecified	nan	6516146_1570121348
213	Data Assurance Manager - East London - Randstad Technologies Ltd	Data Assurance Manager - East LondonData Assurance Manager is required by major non profit organisation, based in East London.  It's a great business, with a genuine social purpose and mission to improve communities all over London.You will be tasked with managing a small team of Data Assurance Analysts and leading a number of workstreams to achieve a single version of truth across multiple platforms, driving data quality improvement, data mapping / data migration, data profiling and master data management projects.  In addition to this, you will be tasked to identify new ways to reduce data quality issues at source by developing improvements to platforms and processes to reduce risk of incorrect data capture and processing errors.You'll need to have experience using data tools for data quality and data migration management as well as have been involved (and operated as the lead) on data migration and data improvement programmes.Key requirements:-Strong experience using data tools for driving/improving Data Quality & Data MigrationMaster Data Management (MDM) project delivery experienceDetailed understanding of Data FrameworksExpert in data integrity & data qualityOperated as a lead on data migration programmesGood knowledge/experience of Business Intelligence & Data AnalyticsTeam lead/management experienceThis is a great opportunity to join a growing business with a great working environment and a big focus on work life balance. Please send an up to date copy of your CV for immediate consideration. Randstad Technologies Ltd is a leading specialist recruitment business for the IT industry. Please note that due to a high level of applications, we can only respond to applicants whose skills & qualifications are suitable for this position. No terminology in this advert is intended to discriminate against any of the protected characteristics that fall under the Equality Act 2010. For the purposes of the Conduct Regulations 2003, when advertising permanent vacancies we are acting as an Employment Agency, and when advertising temporary/contract vacancies we are acting as an Employment Business.	£55,000.00 - £58,000.00  per yeargreat benefits	Stratford, London	Full Time, Permanent	6 Days ago	Computer/IT Services	Unspecified	nan	js8912dam_1571303136
214	Business Data Analyst - Web Recruit	Business Data AnalystBirmingham, West MidlandsCooksongold is a leading global supplier of precious metals in gold, silver, platinum and palladium alloys. We are the UK's largest one-stop shop for the jewellery maker.As a Business Data Analyst in the jewellery industry, you will support the business by setting up and maintaining all system data, including product information, pricing and costs. Working in a team of 3, you will contribute to the development of in-house costing models and practices. You will collect, transform, analyse and report on company products; specifically those bought in.You will test your ability to meet tight deadlines and build your experience in processing large data. In return, we will provide you with on the job training, guidance and the support you need to build on your existing expertise. Your duties will be to:- Develop, build and maintain standard cost data and ensure accuracy and integrity of costs- Challenge current standard costs and where necessary revise calculations to take account of process/supplier changes- Produce business performance reports and presentations- Analyse the data and highlight any area for concern or opportunities for improvement e.g. on data management processes- Liaise with the Supply Chain and Product Management teams to maintain accurate and up-to-date product and pricing information- Support the code creation & auto pricing administration using in-house software (such as AS400)The successful candidate will have:- Grade C (or equivalent) and above in GCSE Maths and English- Previous costing experience and manipulating large data sets - Strong analytical skills with the ability to interrogate and interpret numbers and costing data- Excellent attention to detail- Advanced Excel skills e.g. ability to set up and manipulate Pivot Tables, VLOOKUPs and Sum Ifs.- Highly organised and flexible with excellent communication skills- Ability to quickly learn new skills- Ability to prioritise and schedule work to meet demands set by the department, company or external customer- Excellent verbal and written communication skills- Effective team working skills- Ability to use initiative for independent work- Ability to drive continuous improvements- A proactive approach to problem solvingDesirable- A degree level qualification or equivalent in a business or finance related discipline- Confident presentation skills- Knowledge and experience within the jewellery or manufacturing Industry - Experience with macros, BOMs and SQLHours of work: Total 37.5 hours per week, core office hours are Monday to Thursday 08:30 – 16:45, Friday 08:30 – 15:30 with a 30 minute lunch break each day. Benefits:- Salary range of £25,000 – £28,000 per annum (dependent on experience) - Up to 26 days’ annual leave plus bank holidays- Company pension scheme with employer contributions matched up to 8%- Life Assurance- Discounts on company products, gym memberships and cinema- Free eyecare vouchers with Boots and moreVisit our website to learn more about our products and services.As part of the new starter vetting process the successful candidate will be asked to complete a criminal records check from the DBS and asked to provide references; due to the General Data Protection Regulations (GDPR) please do not disclose referee details on your CV.  Our Job Applicant Privacy Notice can be viewed on our website.To apply for the role of Business Data Analyst, please apply via the button shown. This vacancy is being advertised by Webrecruit. The services advertised by Webrecruit are those of an Employment Agency. Other organisations may call this role Data Analyst, Analyst, Business Analyst, SQL Analyst, Insight Analyst, or Data Insight Analyst. 	£25,000.00 - £28,000.00  per year£25,000 – £28,000 per annum DOE   Benefits:	Birmingham, MID	Full Time, Permanent	Today	Metals and Minerals	nan	Experienced (Non-Manager)	01cook - bi
215	Apprentice Data Analyst - QA LIMITED	Employer description: On Agency is a leading marketing agency working exclusively with charities and not-for-profit organisations.  Since 1997, On Agency has helped clients smash their fundraising targets through bold creative, supporter-centric strategy and data-led design. Job overview: We’re looking for a Junior Data Analyst to join our Brighton agency, which works exclusively with the UK’s best charities.Main role: [Working alongside:] Creatives Account Managers Planners and Strategists You’ll be responsible for:   Supporter segmentation Targeting Data cleansing and campaign analysis Providing our clients with highly accurate data and actionable insights Working alongside and reporting to the Head of Data & Insight You’ll also have the opportunity to develop the Data service offering and increase data understanding, internally and externally. Desirable skills: As this is a technical role, you’ll need knowledge of how to process and analyse data An understanding of Data Protection desirable Experience of using Excel and database Knowledge of 'R' (database tool) desirable Personal qualities: Attention to detailGood communicator - You will to communicate clearly to multiple departments across the agency.Open to change and ready to work in an Agency environment - Being a relatively small business, your day-to-day tasks may change throughout your role. Desired qualifications: Grade C GCSE’s in English and Maths A-Levels in ICT/Business/Computing Or an Apprenticeship in a similar subject (this must be at least the level below the planned programme) Or an International Baccalaureate at level 3 in ICT Future prospects: After completing the apprenticeship, you’ll have the opportunity to gain a permanent position and progress your career. Important Information: QA’s apprenticeships are funded by the Education & Skills Funding Agency (ESFA), an executive agency of the Department for Education. To be eligible for a Government funded apprenticeship you must have lived in the UK or European Economic Area (EEA) for the last 3 consecutive years. 	£18,000.00 - £18,000.00  per year	Brighton, Southern BN29TS	Full Time, Permanent	6 Days ago	Computer/IT Services	Professional	Entry Level	mp-4880-63713
